{
  "schemaVersion": "1.0.0",
  "creatorId": "deck-ready",
  "status": "active",
  "displayName": "Deck Ready",
  "description": "Everything Steam Deck, SteamOS and Steam itself, baby!",
  "links": {
    "youtube": "https://www.youtube.com/@DeckReady"
  },
  "images": {
    "banner": "assets/creators/deck-ready/banner.jpg",
    "channel": "assets/creators/deck-ready/channel.jpg",
    "personal": "assets/creators/deck-ready/personal.jpg"
  },
  "products": ["deckfilter", "decksettings"]
}
