{
  "schemaVersion": "1.0.0",
  "creatorId": "deckfilter",
  "status": "active",
  "displayName": "DeckFilter",
  "description": "I am the creator of DeckFilter & DeckSettings mobile apps. I like Pixel graphics, Point & Click, Action-Adventure, and Walking Simulators. I hate PvP because I am just super bad at it.",
  "steamId": "76561197998925108",
  "links": {
    "website": "https://deckfilter.app/"
  },
  "images": {
    "banner": "assets/creators/deckfilter/banner.jpg",
    "channel": "assets/creators/deckfilter/channel.jpg",
    "personal": "assets/creators/deckfilter/personal.jpg"
  },
  "products": ["deckfilter", "decksettings"],
  "productOverrides": {
    "decksettings": {
      "displayName": "Felix (DeckFilter)",
      "description": "I am the creator of DeckFilter & DeckSettings mobile apps. I like Pixel graphics, Point & Click, Action-Adventure, and Walking Simulators."
    }
  }
}

