{
  "schemaVersion": "1.0.0",
  "creatorId": "baldly-rudy",
  "status": "active",
  "displayName": "Baldly Rudy",
  "description": "Hi! I'm Rudy and I test tech and games so you don't have to. I focus on PC Handhelds and powerful mobile tech.",
  "links": {
    "youtube": "https://www.youtube.com/@baldlyrudy/",
    "x": "https://x.com/baldlyrudy",
    "instagram": "https://www.instagram.com/baldlyrudy/",
    "tiktok": "https://www.tiktok.com/@baldlyrudy/"
  },
  "images": {
    "channel": "assets/creators/baldly-rudy/channel.jpg"
  },
  "products": ["decksettings"]
}

